Organization,Feedback Content,Feedback Link,Page,Feedback reference,Submitted on,Submitted by,User type,Organisation,Organisation size,Transparency register number,Country of origin,Initiative,Additional Message
Twilio (United States),Twilio thanks the European Commission for the opportunity to respond to the Inception Impact Assessment on developing requirements for Artificial Intelligence. Twilio has already submitted a response to the European Commission’s White Paper on Artificial Intelligence – A European Approach where the company highlighted its support for this important discussion and Twilio’s willingness to contribute constructively. Twilio wishes to see the...,https://ec.europa.eu/info/law/better-regulation/have-your-say/initiatives/12527-Artificial-intelligence-ethical-and-legal-requirements/F551003_en,3,F551003,10 September 2020,Irina Michalowitz,Company/business,Twilio,Large (250 or more),067223231522-58,United States,Artificial intelligence – ethical and legal requirements,"Twilio thanks the European Commission for the opportunity to respond to the Inception Impact Assessment on developing requirements for Artificial Intelligence. Twilio has already submitted a response to the European Commission’s White Paper on Artificial Intelligence – A European Approach where the company highlighted its support for this important discussion and Twilio’s willingness to contribute constructively. 
Twilio wishes to see the development of a trusted ecosystem for AI development and deployment in Europe so that the company’s customers can easily and confidently adopt AI-enabled tools that transform how they connect with end-user consumers. With a well calibrated policy framework, particularly regarding the delicate issues of a risk-management and liability regime for AI deployments, Twilio believes that AI can be a key driver of business innovation and economic growth in Europe for years to come. 
Twilio looks forward to further discussion with the European institutions and to contributing to an AI policy framework that delivers real benefits for all Europeans. Please find enclosed Twilio's response to the impact inception assessment."
Fortum Oy (Sweden),"Fortum would like to see a regulatory framework for AI based on the following principles: Accountability should be the key element when creating an AI regulatory framework instead of creating exhaustive lists of sectors and critical use with demands of prior conformity assessments and approval. Accountability-based compliance and governance programs enable organizations to operationalize principles-based laws into risk-based, verifiable...",https://ec.europa.eu/info/law/better-regulation/have-your-say/initiatives/12527-Artificial-intelligence-ethical-and-legal-requirements/F551002_en,3,F551002,10 September 2020,Jens BJÖÖRN,Company/business,Fortum Oy,Large (250 or more),03501997362-71,Sweden,Artificial intelligence – ethical and legal requirements,"Fortum would like to see a regulatory framework for AI based on the following principles: 

Accountability should be the key element when creating an AI regulatory framework instead of creating exhaustive lists of sectors and critical use with demands of prior conformity assessments and approval. Accountability-based compliance and governance programs enable organizations to operationalize principles-based laws into risk-based, verifiable, demonstrable and enforceable corporate practices and controls, supported by technology tools. 

New regulation should only be introduced when there is a gap in GDPR or other legislation. It’s important to avoid regulatory overlaps and conflicts. 

Sectors that already have a primary authority for control and oversights should not be burdened with additional supervision. This would be the case with nuclear where new applications and systems usually gets approval from the national radiation authorities."
Agoria vzw/asbl (Belgium),"“Agoria is the Belgian federation for the technology industry. We are paving the way for all technology-inspired companies in Belgium pursuing progress internationally through the development or application of innovations and which, together, represent some 300,000 employees. We are proud that more than 1,900 member companies trust in the three pillars of our services: consulting, business development and the creation of an optimal business...",https://ec.europa.eu/info/law/better-regulation/have-your-say/initiatives/12527-Artificial-intelligence-ethical-and-legal-requirements/F550994_en,3,F550994,10 September 2020,Jelle Hoedemaekers,Company/business,Agoria vzw/asbl,Medium (50 to 249 employees),68004524380-10,Belgium,Artificial intelligence – ethical and legal requirements,"“Agoria is the Belgian federation for the technology industry. We are paving the way for all technology-inspired companies in Belgium pursuing progress internationally through the development or application of innovations and which, together, represent some 300,000 employees. We are proud that more than 1,900 member companies trust in the three pillars of our services: consulting, business development and the creation of an optimal business environment.”. 

Agoria thanks the European Commission for its efforts to foster Artificial Intelligence and for the opportunity to provide inputs regarding its Proposal for a legal act laying down requirements for Artificial Intelligence, which presents several options for future legislation. 

Firstly, Agoria is in favour of Option 1 of the alternative options to the baseline scenario, i.e. EU “soft law”, implying a non-legislative approach to facilitate and spur industry-led intervention without putting forward an EU legislative instrument. In addition, we believe that a “soft law” approach could build upon existing national initiatives and encourage a quicker industrial transformation using AI-driven systems to automate and reinvent fundamental industrial processes. Secondly, we acknowledge that others may see specific risks relating to the usage of AI in certain situations, justifying a legislative intervention. However, we must stress that the possibility of such risks arising at some point in the future does not imply that this is the case today, neither sporadically nor systematically. We urge the European Commission to analyse what is wrong in practice, before considering the optimal means of resolving these issues. Once this is clear, requirements for these specific high-risk situations will become evident and remedies may be needed. Where remedies are needed, enforcement methods should be considered, but not beforehand. Suggesting ex-ante enforcement mechanisms without any background is causing a lot of uncertainty, and SME’s specifically will be put at a disadvantage by this. 

Agoria believes that before choosing any option for a legislative intervention, existing regulation must be analysed carefully, identifying potential gaps precisely. This analysis should help to propose the adequate tools to fill those gaps and to establish a legally sound definition of AI. Given that AI has many meanings for different people and that many definitions of this term exist already, it is vital for the success of any AI related legislative action to define AI in a robust way. The most important aspect to keep in mind is that AI is not a product in itself, but rather a technology embedded in products, services and applications, which may be used in an extensive array of sectors, which puts all concerns related to AI in another perspective. For example, the health sector is already heavily regulated, and additional requirements should fit into the existing mechanisms. Additional unnecessary AI-related requirements within the EU product legislation should be avoided."
Syntec Numérique (France),"Syntec Numérique soutient la Commission dans son ambition de stimuler le développement et l'adoption de l'IA et des nouvelles technologies, tout en veillant à ce que les risques potentiels soient traités de manière adéquate. Afin de garantir la cohérence avec la législation sectorielle existante, la future proposition de réglementation de l’IA devra tenir compte de la réglementation européenne existante et qui couvre déjà l’application de l’IA...",https://ec.europa.eu/info/law/better-regulation/have-your-say/initiatives/12527-Artificial-intelligence-ethical-and-legal-requirements/F550993_en,3,F550993,10 September 2020,Anissa Kemiche,Trade union,Syntec Numérique,Small (10 to 49 employees),565078326484-60,France,Artificial intelligence – ethical and legal requirements,"Syntec Numérique soutient la Commission dans son ambition de stimuler le développement et l'adoption de l'IA et des nouvelles technologies, tout en veillant à ce que les risques potentiels soient traités de manière adéquate. Afin de garantir la cohérence avec la législation sectorielle existante, la future proposition de réglementation de l’IA devra tenir compte de la réglementation européenne existante et qui couvre déjà l’application de l’IA (protection des droits fondamentaux, des consommateurs et sécurité des produits). 

Compte tenu de la diversité des applications et des technologies de l'IA, nous recommandons à la Commission d'adopter une approche ciblée et fondée sur les risques. Une telle approche devrait être basée sur des définitions claires. Elle doit prendre en compte le risque posé par le déploiement d'un système d'IA, le domaine d'application, le type de déploiement et la nature des risques.

Vous trouverez ci-joint un détail de nos propositions sur les quatre options présentées dans l'analyse d'impact."
Huawei (Belgium),We are grateful to the European Commission for this opportunity to provide input towards proposals for legislative action on requirements for Artificial Intelligence (AI). We encourage EU policymakers to pursue a collaborative and inclusive approach for preparation of their proposals including the perspective from global industry. We feel that the challenge of risk assessment should be addressed as a priority in the proposals. A naïve...,https://ec.europa.eu/info/law/better-regulation/have-your-say/initiatives/12527-Artificial-intelligence-ethical-and-legal-requirements/F550992_en,3,F550992,10 September 2020,Angeliki Dedopoulou,Company/business,Huawei,Large (250 or more),114467111412-38,Belgium,Artificial intelligence – ethical and legal requirements,"We are grateful to the European Commission for this opportunity to provide input towards proposals for legislative action on requirements for Artificial Intelligence (AI). We encourage EU policymakers to pursue a collaborative and inclusive approach for preparation of their proposals including the perspective from global industry.
We feel that the challenge of risk assessment should be addressed as a priority in the proposals. A naïve approached focused only on high-risk applications can be an unintentionally blunt approach to risk assessment of AI. A change to the contextual integrity of AI systems may trigger re-evaluation, re-training, or re-development. Huawei encourages a tech-neutral approach for risk assessment of applications according to scenarios instead of generic technologies. A better definition is needed for high-risk applications to ensure legal clarity and certainty. The definition of AI high risk applications provided in the AI White Paper is not the same as the one provided in the civil liability report. The majority of machine learning applications are not high-risk and would not be constrained by ex-ante requirements. 
Regulatory oversight complements legislation through consistency and harmonisation of decisions and requirements from competent authorities at the national-level and EU-level. Any definition of high-risk scenarios for conformity assessment should be as clear as possible and regularly reviewed through an industry-led, transparent process.
We recognize the challenge to achieve consistency with other relevant legislation. To ensure Europe is fit for the digital age the EU must enable continued trust in AI. Trust needs to be based on facts. Facts must be verifiable, and verification must be based on international, globally-recognized, common standards. We believe that this is an effective model for building trust in the digital era. Labelling is potentially problematic, and so what is required is a thorough analysis of the various approaches to this, such as certification, third—party audit, benchmarking and ratings etc. Huawei has commissioned a paper which will be published in Q4 2020 that speaks to the need for an assurance scheme that considers the complexity of the AI market – we are a rich and complex ecosystem that needs to come together to ensure high quality and high trust for customers. We are committed to supporting industry initiatives that, at a global level, achieve the design and promotion of standards.
It is also essential to work with standards organizations to further codify the best practices of AI governance into global standards and specifications. Closer partnership between the public and private sector would effectively collect industry best practices for AI governance and provide minimum acceptable standards for different parts of the supply chain.
Therefore, we recommend these proposals include a healthy diet of industry-led activity with self-regulation that complements any formal regulation on requirements for AI. This is why we also believe that a combination of the four different sets of policy options will better fit in the current context. We need multi-stakeholder initiatives and governance for a healthy and competitive market that can deliver sustainable economic growth and bring real benefits to people and society at large. Together, we can pass the benefits of digital technology to everyone.
Europe needs to lead the world out of the coronavirus pandemic and into its recovery. We believe in the power of innovation. Huawei has been a trusted partner in Europe for 20 years. We are committed to support EU policymakers prepare their proposals in the policy area of AI and deliver a Europe fit for the digital age."
Związek Pracodawców Branży Internetowej IAB Polska (Poland),Związek Pracodawców Branży Internetowej IAB Polska przedkłada w załączeniu wkład do konsultacji Komisji Europejskiej dot. Sztucznej Inteligencji.,https://ec.europa.eu/info/law/better-regulation/have-your-say/initiatives/12527-Artificial-intelligence-ethical-and-legal-requirements/F550987_en,3,F550987,10 September 2020,Magda Bublewicz,Business association,Związek Pracodawców Branży Internetowej IAB Polska,Small (10 to 49 employees),050841318640-60,Poland,Artificial intelligence – ethical and legal requirements,Związek Pracodawców Branży Internetowej IAB Polska przedkłada w załączeniu wkład do konsultacji Komisji Europejskiej dot. Sztucznej Inteligencji.
SIENNA Project (United Kingdom),"SIENNA, a European Horizon 2020-funded project, is looking into ethical, legal and human rights issues and is developing ethical guidelines for human genomics, human enhancement and AI & robotics. We welcome the language that puts fundamental rights and societal values first. Unlike the European Commission White Paper on AI where the focus was on building consumers’ and businesses’ trust in AI to increase uptake of the technology, the...",https://ec.europa.eu/info/law/better-regulation/have-your-say/initiatives/12527-Artificial-intelligence-ethical-and-legal-requirements/F550986_en,3,F550986,10 September 2020,Nicole Santiago,Other,SIENNA Project,Small (10 to 49 employees),,United Kingdom,Artificial intelligence – ethical and legal requirements,"SIENNA, a European Horizon 2020-funded project, is looking into ethical, legal and human rights issues and is developing ethical guidelines for human genomics, human enhancement and AI & robotics. We welcome the language that puts fundamental rights and societal values first. Unlike the European Commission White Paper on AI where the focus was on building consumers’ and businesses’ trust in AI to increase uptake of the technology, the Inception Impact Assessment rightly prioritises the protection and safety of individuals and society at large. While we recognize there are many beneficial applications of AI, any deployment must be accompanied by a necessity and proportionality assessment, as well as ensure adequate and sufficient measures are taken to protect the fundamental rights and societal values from potential harms.

We recommend a combination of Option 2 (EU legislative instrument setting up a voluntary labelling scheme) and Option 3 (EU legislative instrument establishing mandatory requirements). A legislative instrument should go beyond high-level principles and obligations. However, the framework cannot be too specific or detailed, as that risks unintentionally narrowing the scope and impact of the framework. Furthermore, the legislative framework must be agile enough to respond to the rapid development of AI and related technologies. As such, an EU legislative instrument should involve both ex-ante and ex-post enforcement mechanisms. 

We believe that Option 3(b) (limiting the scope to high-risk applications) may be sufficient if the determination of ‘high-risk’ is well-constructed. However, given this determination will be a crucial element of the whole framework and will have a significant impact on whether the framework will effectively serve its purpose, extreme caution should be taken to set the criteria in a manner that is robust. Regardless of whether the framework is limited to high-risk applications, specific rules will be necessary for specific categories of AI applications. 

Option 2 (EU legislative instrument setting up a voluntary labelling scheme) can be one complementary way to enhance trust and verify compliance with certain rules. However, it is vital that this must not be understood as a replacement for legal responsibility. Additionally, voluntary certification labels must not become self-serving or a business-manipulated front for hiding risks and harms.

We do not agree that there are no direct significant negative social impacts or environmental impacts expected from the proposed measures. Further assessment of expected impacts associated with the proposed regulatory framework for AI is needed, particularly in regard to social and environmental impacts."
SHERPA Project (United Kingdom),"SHERPA is an EU-funded Horizon 2020 project that focuses on ethical and human rights aspects of smart information systems (artificial intelligence and big data analytics). We welcome language in this Inception Impact Assessment that prioritises protection of human rights and recognises both the benefits and harms of AI. The protection of human rights and safety is a societal priority, and not only a means to create (or the outcome of creating)...",https://ec.europa.eu/info/law/better-regulation/have-your-say/initiatives/12527-Artificial-intelligence-ethical-and-legal-requirements/F550985_en,4,F550985,10 September 2020,Rowena RODRIGUES,Other,SHERPA Project,Small (10 to 49 employees),,United Kingdom,Artificial intelligence – ethical and legal requirements,"SHERPA is an EU-funded Horizon 2020 project that focuses on ethical and human rights aspects of smart information systems (artificial intelligence and big data analytics). We welcome language in this Inception Impact Assessment that prioritises protection of human rights and recognises both the benefits and harms of AI. The protection of human rights and safety is a societal priority, and not only a means to create (or the outcome of creating) trustworthy AI.

We also strongly agree that existing EU law needs more effective enforcement, that effective redress mechanisms are needed, and that we must be concerned about intended and unintended negative outcomes. 

We believe that it is absolutely critical that the EU develop a mandatory regulatory framework of ex-ante and ex-post enforcement mechanisms to ensure that AI systems are safe and do not violate fundamental rights and ethical principles.  A strong legal standard must be set at the EU-level that establishes a baseline, encourages high standards of protection of fundamental rights and societal values, and minimizes inconsistency and fragmentation at the Member State-level. Therefore, the SHERPA project strongly supports a combination of Option 2 (EU legislative instrument setting up a voluntary labelling scheme) and Option 3 (EU legislative instrument establishing mandatory requirement for all or certain types of AI). Depending on how risk is determined, by whom, and which criteria are used, the SHERPA project might support limited regulation for high-risk only AI (sub-option 3(b)).

The SHERPA project also strongly recommends further assessment of expected impacts. An impact assessment should also evaluate the risks associated with failure to act, and not only the impacts of a potential regulatory framework."
FEDMA (Belgium),FEDMA previously answered the consultation on the white paper on AI. We would like to share the below insights: • The work of the High-Level Expert Group on criteria for risk assessment and the feedback that they are receiving from the industry should be considered. • Self-learning systems are not new nor is information gathering for a better more objective decision process (e.g. bank loan; better information might often help to get the...,https://ec.europa.eu/info/law/better-regulation/have-your-say/initiatives/12527-Artificial-intelligence-ethical-and-legal-requirements/F550978_en,4,F550978,10 September 2020,Geraldine PROUST,Business association,FEDMA,Micro (1 to 9 employees),39300567160-02,Belgium,Artificial intelligence – ethical and legal requirements,"FEDMA previously answered the consultation on the white paper on AI. We would like to share the below insights: 
• The work of the High-Level Expert Group on criteria for risk assessment and the feedback that they are receiving from the industry should be considered. 
• Self-learning systems are not new nor is information gathering for a better more objective decision process (e.g. bank loan; better information might often help to get the loan). AI is simply an optimization of both. 
• If personal data is involved, Art 22 GDPR covers the data protection issues. 
• It is of the utmost importance that the GDPR be implemented in a fair and balanced manner. Indeed, legitimate interest and pseudonymization are key GDPR tools for companies to use AI (e.g. cleaning a contact list with a Robinson list). When the industry relies on legitimate interest for processing of personal data, the controller must do a legitimate interest assessment test in 3 steps: (a) is the purpose of the processing legitimate? (b) is the processing necessary? (c) do the interests of the controller override the rights and freedoms of the individual? Currently, legitimate interest is a legal basis which is under growing pressure and the EDPB has started the discussions on guidelines for LI. If the right balance is not met between consent and LI, then many industry sectors, such as data marketing, will disappear or will not be able to use AI, leaving behind a less competitive market dominant by large tech intermediaries.
• FEDMA previously referred to the EUTA High Level Principles on AI. In line with those principles, we have strong reservations about extending legal requirements to all AI applications. As the majority of AI day-to-day applications today are low risk, we urge the EU institutions to conduct a thorough assessment of the existing legislation, especially the civil liability regime, before introducing any new proposals specifically targeting AI-driven technologies and applications. Regarding the possibility of new risk assessment being imposed upon businesses to define whether they are using low or high risk AI applications, we encourage the European Commission to provide a framework for internal risks assessments for low-risk applications, and thoroughly assess who would be responsible for leading external risk assessments for high-risks applications. Indeed, it is likely that external auditors or agencies will need to gain access to sensitive personal data under GDPR to assess the fairness or degree of risk carried out by one AI system Checking the fairness or risks level in any algorithm will necessarily require the use of particularly sensitive data under GDPR, such as those related to sex, ethnicity, age, religion, etc. Soft law and voluntary labelling should be preferred to new regulations where feasible, as they create only marginal administrative burden where binding requirements could create further red tape for EU businesses. At the same time, providing a harmonised EU framework would reduce compliance costs for businesses operating across the EU and avoid a plethora of conflicting AI rules. We need to ensure that the future EU framework is sufficiently flexible so that it is not outdated in a short span of time. We disagree with the Commission’s assessment that the social impact of the future AI framework will be limited, AI will have an extensive positive social impact."
