Organization,Feedback Content,Feedback Link,Page,Feedback reference,Submitted on,Submitted by,User type,Organisation,Organisation size,Transparency register number,Country of origin,Initiative,Additional Message
European Digital Rights (EDRi) (Belgium),"Aims: 1. EDRi argues that promoting AI uptake should not be an end in itself, rather a detailed framework to ensure all AI is lawful and fundamental rights compliant. Problem definition: 2. The definition of “remote biometric identification” is overly narrow. All mass surveillance uses of biometrics invoke severe fundamental rights implications, and therefore should be in scope. 3. Greater attention is needed to the potential...",https://ec.europa.eu/info/law/better-regulation/have-your-say/initiatives/12527-Artificial-intelligence-ethical-and-legal-requirements/F550551_en,10,F550551,09 September 2020,EDRi Policy,Non-governmental organisation (NGO),European Digital Rights (EDRi),Small (10 to 49 employees),16311905144-06,Belgium,Artificial intelligence – ethical and legal requirements,"Aims:
    1. EDRi argues that promoting AI uptake should not be an end in itself, rather a detailed framework to ensure all AI is lawful and fundamental rights compliant. 

Problem definition:
    2. The definition of “remote biometric identification” is overly narrow. All mass surveillance uses of biometrics invoke severe fundamental rights implications, and therefore should be in scope.
    3. Greater attention is needed to the potential impact of AI applications on human rights.
    4. Dataset bias is only one source of AI bias, not overlooking bias in programming of the systems, and the discrimination resulting from deployment of AI systems in already discriminatory contexts, e.g. facial recognition and predictive policing in the context of proven systemic racial discrimination. 
    5. Discrimination is not “immaterial harm”; it can have highly material consequences: threats to liberty and safety when AI is deployed for policing, migration control; safety and financial implications when sensitive identity traits are inferred in the delivery of essential public services; or in employment.
    6. Dual uses of AI pose numerous threats to data protection and fundamental rights and must be addressed. 

Impact assessment
    7. The impact on fundamental rights must be given primary attention over assumed economic impact. All presumed benefits of AI, particularly when invoked in public sector must be demonstrated with scientific criteria. 
    8. Societal level harms such as impact on democracy must be included, with a specific reference to uses of AI for content moderation and the impact on democracy.
    9. AI has an environmental impact in terms of encouraging wasteful development and consumption. When AI systems are proposed as solutions to climate change, evidence must be presented.
    10. Fundamental rights impact must be further detailed in an HRIA, in particular with respect to rights to privacy, freedom of assembly and non-discrimination. The HRIA must articulate how fundamental rights will be de facto protected within the  proposed regulatory framework.

Policy Options:
    11. EDRi recommends that the policy options are amended to include legislation which defines the scope of lawful AI and introduces prohibitions for uses which violate fundamental rights, including untargeted biometric surveillance, predictive policing, migration control and other uses detailed in EDRi’s AI recommendations and case bank of impermissible uses. The prohibition of certain uses of AI is necessary to achieve the stated  aim of preventing harm.
    12. For legal uses of AI, EDRi favours the application of safeguards to all uses of AI (3C) . EDRi recommends a rejection of the risk-based categorisation and the sectoral delineation of ‘high risk’, which will create a gap in fundamental rights protections. Mandatory, external HRIAs, at all stages should evaluate the impact of all AI systems on a case-by-case basis to determine safeguards, with a range of options (including prior conformity assessment, notification to oversight body,  prohibition).
    13. For public sector uses of AI, the EU must introduce mechanisms of democratic oversight. This includes consultation with marginalised communities and people most affected by particular deployments. Democratic oversight must extend to  decision-making power for those affected.
    14. The Commission must take specific steps to ensure enforcement of fundamental rights in upcoming legislation, and individual and collective redress.
    15. EDRi rejects options 0-2. Individuals impacted are not ‘customers’ and often not consumers of AI, but subjects to AI systems. Soft law, industry-led or voluntary schemes will be insufficient to protect their rights.

Find furhter information in EDRi’s recommendations on artificial intelligence regulation and ban on biometric mass surveillance position. EDRi attaches use cases of AI deployments in Europe which require prohibition in law."
European Association of Urology (Belgium),"The European Association of Urology, a membership organisation of more than 18 000 urologists from all over Europe, sees value in the use of Artificial Intelligence (AI) both in terms of the activities of our professional association (e.g and decision support and development of evidence based clinical guidelines), and in our clinical roles as medical professionals (e.g. in the early detection of cancer, treatment of tumours and other...",https://ec.europa.eu/info/law/better-regulation/have-your-say/initiatives/12527-Artificial-intelligence-ethical-and-legal-requirements/F550523_en,10,F550523,09 September 2020,Sarah Collen,Non-governmental organisation (NGO),European Association of Urology,Medium (50 to 249 employees),703095536854-37,Belgium,Artificial intelligence – ethical and legal requirements,"The European Association of Urology, a membership organisation of more than 18 000 urologists from all over Europe, sees value in the use of Artificial Intelligence (AI) both in terms of the activities of our professional association (e.g and decision support and development of evidence based clinical guidelines), and in our clinical roles as medical professionals (e.g. in the early detection of cancer, treatment of tumours and other urological conditions, robotic surgery and for use in clinical trials). 

In urology, we already have experience of this important interaction between the uptake / use of novel technology and medical practice in the field of robotic surgery.
 
In the use of AI technologies, medical professionals will often be users and/or deployers of these tools and will often be responsible for the ‘human oversight’ when they are used in care settings. It is therefore essential that these new technologies have checks and balances in place that ensure that they are safe and effective for their intended use, just as they would need to be in place for new medical devices or pharmaceuticals.

Many of the AI tools we use in a clinical setting are likely to fall under ‘high risk’ devices mentioned in option 3b. Indeed, many are likely to have important legal and physical impacts on our patients (supporting decisions on treatments, for example) and the general public (when it comes to decisions regarding risk based screening, for example). These technologies will have an important impact on the medical profession, requiring the need for new skills and training, and a clear legal framework outlining responsibility and liability when things go wrong. Just like any new technology or pharmaceutical, it must be clear what functions any new AI tool has been proven to be effective and safe in delivering. In the case of AI, the limitations of the tool will directly relate to the limitations of the data driving the tool in the first place. The limitations of the data used must be explained in a clear and transparent way.

A mandatory, stand alone, legal standard for high risk AI defined in 3b using a conformity assessment procedure  (mentioned in the White Paper on AI) would give legal clarity on a number of these issues. For medical devices, this may also be achieved by updating of the relevant standards (ieg IEC 82304)  linked to the Medical Devices Regulation. 

In terms of application of such legislation in the health sector,  it must make provision for feedback from experts from healthcare professionals, patients and the general public. The medical world is rightly highly regulated already. It is a sector well used to asking ethical questions. The risks and benefits will need to be defined by all actors, including healthcare professionals and patients, payers and industry.  There will  be interaction with data protection, pharmaceutical and medical device legislation and the boundaries and complementarity must be carefully defined.  It will be essential to understand the human oversight and control/ responsibility over which aspects of the AI device and this information must be clearly described to the user by the manufacturer. 

For this reason, there must be provision for opinions from healthcare professionals and experts imbedded into the AI conformity assessment  process in the health sector. The Medical Devices Regulation, for example,  has a included the creation of Medical Expert Panels through the JRC who will play a role in the assessment process of new medical devices. This model could be considered as a model to be replicated in any proposed AI legislation. 

The new regulatory approach must go hand in hand with a broader package of education, training and skills for medical professionals so that these tools can be safely deployed in the most effective manner, as outlined in the AI White Paper. European medical societies such as the EAU can support these initiatives."
Handelsverband Deutschland (HDE) (Germany),"Der HDE begrüßt das ausgeglichene Inception Impact Assessment der Kommission, das die Interessen der betroffenen Wirtschaftsakteure – insbesondere von KMU – ausdrücklich mitberücksichtigt und deren potenzielle Belastung durch etwaige Regulierung dem Nutzen gegenüberstellt. Auch der explizite Fokus auf legislative Kohärenz und Konsistenz in den Bereichen Haftung, Produktsicherheit und Grundrechtsschutz ist positiv zu bewerten. Dieser...",https://ec.europa.eu/info/law/better-regulation/have-your-say/initiatives/12527-Artificial-intelligence-ethical-and-legal-requirements/F550505_en,10,F550505,09 September 2020,Fabian FECHNER,Business association,Handelsverband Deutschland (HDE),Small (10 to 49 employees),31200871765-41,Germany,Artificial intelligence – ethical and legal requirements,"Der HDE begrüßt das ausgeglichene Inception Impact Assessment der Kommission, das die Interessen der betroffenen Wirtschaftsakteure – insbesondere von KMU – ausdrücklich mitberücksichtigt und deren potenzielle Belastung durch etwaige Regulierung dem Nutzen gegenüberstellt. Auch der explizite Fokus auf legislative Kohärenz und Konsistenz in den Bereichen Haftung, Produktsicherheit und Grundrechtsschutz ist positiv zu bewerten. Dieser eingeschlagene Weg muss mit der Folgenabschätzung und dem Gesetzgebungsvorschlag konsequent weiter beschritten werden. Denn: Wir bewegen uns beim Thema KI in einem wettbewerblichen Spannungsfeld und müssen dem Innovationsraum Europa einen Freiraum für technologische Entwicklungen und wirtschaftliches Wachstum bieten, anstatt Fortschritt unbegründet zu erschweren. Das Verständnis von KI sollte unserer Einschätzung deshalb unter einer gestalterischen Prämisse stehen: Wir erschaffen Künstliche Intelligenz; wir gestalten, trainieren und entwickeln die Systeme weiter.

KI ist keine weitere technische Entwicklung, die einer Sonderregulierung bedarf. Es ist vielmehr eine Basis-Innovation, die zahlreiche Geschäftsmodelle verändern und neue ermögli-chen wird. Deshalb ist der HDE überzeugt, dass es keiner gesonderten KI-Gesetzgebung bedarf, sondern der bestehende Rechtsrahmen, wie die DSGVO, das Gesetz gegen unlauteren Wettbewerb (UWG) oder Vorschriften des Allgemeinen Gleichbehandlungsgesetzes (AGG), Verbraucher*innen hinreichend schützt. 

Was in der analogen Wirtschaft mit menschlichen Entscheidungen gilt, sollte auch in der digitalen Wirtschaft mit datenbasierten Entscheidungen mitgedacht werden. Existierende Vorschriften sollten daher überprüft und nur bei nachgewiesenem Bedarf gezielt an die von KI-Systemen ausgelöste Entwicklung angepasst werden. Somit haben wir als HDE eine klare Präferenz für die Regulie-rungsoptionen 1 und 2 aus dem Inception Impact Assessment - bzw. eine Kombination davon. 

Ein freiwilliges Kennzeichnungssystem könnte für die notwendige Transparenz und Orientierung sor-gen, ohne die betroffenen Unternehmen übermäßig zu belasten.  Dabei muss gewährleistet sein, dass vor allem KMU in der Breite extern generierte „KI as a service“ auch praktisch nutzen können, da sie vielfach nicht in der Lage sein werden, KI-Systeme selbst zu entwickeln.

Sollte aus politischen Gründen entgegen der Position des HDE dennoch eine Regelung für erforder-lich gehalten werden, so muss diese anwendungsbezogen und risikobasiert sein. Vor dem Hinter-grund der aufgeführten wirtschaftlichen Auswirkungen sollte sich der Gesetzgeber daher maximal für die Optionen 3a oder 3b entscheiden. Sollte man sich für eine risikoorientierte Regulierung entschei-den, ist es absolut notwendig, dass „KI-Anwendungen mit hohem Risiko“ klar, zukunftsfest und rechtssicher definiert und abgegrenzt werden. Grundsätzlich halten wir den Ansatz, sich bei der Risi-kobewertung vor allem auf den Sektor zu konzentrieren für richtig, allerdings wirft die vorgeschlage-ne Risikobewertung Fragen und Probleme bei der Abgrenzung auf: Ist die Liste der betroffenen Sek-toren abschließend? Ist die Liste der kritischen Verwendungszwecke abschließend? Was genau sind „Auswirkungen auf die Rechte einer natürlichen Person“? Dieser Begriff scheint extrem offen. Wer-den die beiden Faktoren „Sektor“ und „Auswirkung“ immer kumulativ angewendet? Welche weiteren Ausnahmen von der Zwei-Faktor-Bewertung – neben KI bei der Einstellung von Beschäftigten – gibt es noch?

In Bezug auf Optionen 3a (Beschränkung des Rechtsinstruments auf bestimmte KI-Anwendungen wie biometrische Identifizierungssysteme) möchten wir zudem zu bedenken geben, dass bestimmte biometrische Identifikationssysteme zu maßgeblichen Innovationen im Handel beitragen, wie z.B. das Bezahlen per Fingerabdruck. Diese sollten im Sinne der Innovationsförderung sowie der Erleich-terung von Prozessen für den Kunden und Anbieter unter bestimmten Bedingungen weiterhin mög-lich sein."
CECE - Committee for European Construction Equipment (Belgium),"CECE welcomes the opportunity to comment on the European Commission’s Inception Impact Assessment on a proposal for a legal act laying down requirements for Artificial Intelligence. Regarding the different policy options proposed, we would like to share the following comments: - POLICY OPTION 1 For the construction machinery sector, we do not see any benefits of additional requirements for AI-enhanced subsystems in our products, since this is...",https://ec.europa.eu/info/law/better-regulation/have-your-say/initiatives/12527-Artificial-intelligence-ethical-and-legal-requirements/F550504_en,10,F550504,09 September 2020,Caio Lobo,Business association,CECE - Committee for European Construction Equipment,Micro (1 to 9 employees),60534525900-25,Belgium,Artificial intelligence – ethical and legal requirements,"CECE welcomes the opportunity to comment on the European Commission’s Inception Impact Assessment on a proposal for a legal act laying down requirements for Artificial Intelligence. Regarding the different policy options proposed, we would like to share the following comments:

- POLICY OPTION 1
For the construction machinery sector, we do not see any benefits of additional requirements for AI-enhanced subsystems in our products, since this is already covered by the Machinery Directive 2006/42/EC; we therefore prefer option 1.
 
For the products of our industry – mobile machinery of all sizes – the Machinery Directive 2006/42/EC, having technology neutrality as one of its core principles, already covers safety for those machines using AI-enhancements for operation.
 
According to the Machinery Directive 2006/42/EC, the manufacturer has to take the necessary measures to eliminate any risk throughout the foreseeable lifetime of the machinery, which includes the phases of transport, assembly, dismantling, disabling and scrapping. This includes any machine learning capabilities.
 
- POLICY OPTION 2
For the products under the scope of the Machinery Directive 2006/42/EC, the CE marking already indicates that the risks associated with state-of-the-art AI-enhancements have been sufficiently mitigated, therefore additional labelling is not necessary.
 
- POLICY OPTION 3A + 3B
We reserve our position on option 3 depending on the criteria to be defined for the category of ‘high-risk’ applications. We expect stakeholders (especially the industry) to be  thoroughly consulted when those criteria are defined.
 
- POLICY OPTION 3C
A legislation covering all types of AI use poses the threat of hampering innovation and putting unjustified burden on many narrow AI-enhanced products; where the AI-enhanced function may have tight operational limits, operates in a low-risk application, or is subject to close human oversight during its entire learning phase.
 
- POLICY OPTION 4
No specific statement for policy option 4."
Philips (Netherlands),Philips welcomes the opportunity to provide feedback on the roadmap for AI ethical and legal requirements. Please see our feedback in the attachment.,https://ec.europa.eu/info/law/better-regulation/have-your-say/initiatives/12527-Artificial-intelligence-ethical-and-legal-requirements/F550483_en,10,F550483,09 September 2020,Aleksandra Appelfeld,Company/business,Philips,Large (250 or more),035366013790-68,Netherlands,Artificial intelligence – ethical and legal requirements,Philips welcomes the opportunity to provide feedback on the roadmap for AI ethical and legal requirements. Please see our feedback in the attachment.
Anonymous,"AI is a fast growing technology that can and will be very useful to predict and optimise resources. The City of Stockholm welcomes the EUs ambition to ensure an appropriate ethical and legal framework based on the Unions values. It is however necessary to ensure that the AI we use is safe, lawful and in line with EUs existing and fundamental rights. AI must be trustworthy eg regarding protection of personal data, non-discrimination, product...",https://ec.europa.eu/info/law/better-regulation/have-your-say/initiatives/12527-Artificial-intelligence-ethical-and-legal-requirements/F550477_en,10,F550477,09 September 2020,,,,,,,Artificial intelligence – ethical and legal requirements,"AI is a fast growing technology that can and will be very useful to predict and optimise resources. The City of Stockholm welcomes the EUs ambition to ensure an appropriate ethical and legal framework based on the Unions values. It is however necessary to ensure that the AI we use is safe, lawful and in line with EUs existing and fundamental rights. AI must be trustworthy eg regarding protection of personal data, non-discrimination, product safety and liability. 

A changing world brings with it new challenges; globalization, digitalisation, the need for sustainable development, skills supply and a strong demographic development with demands for a rapid expansion of the city's infrastructure, housing and welfare sector and an aging population. The expectations on public authorities are high; citizens expect the same level of service that the private sector can offer. Consequently local authorities need to constantly improve and streamline services and working methods. AI and automation offers new tools to tackle the challenges we face;eg it has the opportunity to acquire and use new information at a pace that humans cannot thus helping us in keeping up with the development of knowledge. 

Development and usage of AI brings about new challenges linked to new digital technology. A number of ethical and legal issues related to AI need to be addressed; in the absence of coherent EU guidance, so-called ""untrustworthy"" AI could arise because there is strong commercial pressure on the issue. The City of Stockholm supports the Commissions review or risks connected to AI and that these are also communicated. Some concerns/potential risks regarding AI are for example:

• Non-transparent decision-making
• Different types of discrimination (gender, race)
• Invasion of citizens’ privacy 
• Usage of AI for criminal purposes

There is also a need to be observant of the social aspects; there may be an increased risk of loneliness and isolation if AI-based, automated welfare services are used to replace the service that currently are performed with the help of personal contact.

There is a strong global competition within the field of digitalisation and AI. The EU must act as one, based on European ethical values, to promote AI development in Europe. In this context it is important to emphasize the need to find viable ways for introducing and using secure AI that contribute to local, regional, national and European development, in an ethically and legally sustainable manner.

In the development of regulations for AI there is a need to clearly specify which types of legal requirements that are mandatory for the different authorities, organisations and companies(etc) concerned, especially with regard to high-risk applications and quality assurance of AI systems.

New technology such as AI is dependent on the good management of data; the amount, the quality and the availability of data is key to the successful implementation of AI. Open data needs to be correct, consequent and coherent. AI systems and algorithms can hide bias which might lead to high risks for people’s safety. Safety and reliability tests of AI systems are burdensome for local public authorities. There is need for the EU to enforce obligatory measure for companies giving them obligations to report which algorithms are used in systems which they deliver. 

The Commission states that different options for AI risk management will be evaluated. ""Soft legislation"" would mean building on ethical principles that have already been developed by the EU through the HLEG (High-Level Expert Group on Artificial Intelligence) and by various industries and organizations. “Hard legislation” would mean significantly greater requirements for documentation and follow-up by both supplier and customer. The City of Stockholm would therefore like to urge the Commission to make an assessment of how costs incurred for various actors can be set against the security aspect/effect of a stricter legislation."
