Organization,Feedback Content,Feedback Link,Page,Feedback reference,Submitted on,Submitted by,User type,Organisation,Organisation size,Transparency register number,Country of origin,Initiative,Additional Message
EUnited AISBL (Belgium),"EUnited is convinced that artificial intelligence (AI) drives and contributes to the digital and green transformation. It can do so across a broad range of sectors from healthcare to manufacturing and beyond, which in turn will lead to badly needed economic growth and the ability to meet numerous other societal challenges. EUnited supports the principle and pursuit of trustworthy, human-centric, and ethical AI in Europe. Nevertheless, it...",https://ec.europa.eu/info/law/better-regulation/have-your-say/initiatives/12527-Artificial-intelligence-ethical-and-legal-requirements/F550923_en,6,F550923,10 September 2020,Jethro Schiansky,Business association,EUnited AISBL,Micro (1 to 9 employees),0289344948-82,Belgium,Artificial intelligence – ethical and legal requirements,"EUnited is convinced that artificial intelligence (AI) drives and contributes to the digital and green transformation. It can do so across a broad range of sectors from healthcare to manufacturing and beyond, which in turn will lead to badly needed economic growth and the ability to meet numerous other societal challenges.
EUnited supports the principle and pursuit of trustworthy, human-centric, and ethical AI in Europe. Nevertheless, it reminds the Commission that – contrary to the statements made in the Inception Impact Assessment - the reality today is that uptake and investment in AI is greatest in areas of the world where no regulation yet hampers or stifles its deployment. Europe is currently losing the global AI race. The stipulation of trustworthy AI being the major force for gaining a competitive edge vis-à-vis China and the US is unrealistic. We believe it is therefore of vital importance to strike the right balance between EU intervention on the one hand and ensuring the competitiveness and innovation potential of our businesses, whilst protecting the rights of our citizens, on the other. In general, we believe that more work can be done to boost EU businesses by, for example, open-sourcing datasets and sharing ongoing research. Finally, it should also be pointed out that the compliance costs related to - what might appear to be only minor regulatory interventions - may be decisive for the competitiveness of many European businesses, especially SMEs. 
EUnited favours Policy Option 1 contained in the Inception Impact Assessment (IIA). We believe that this soft law approach could quickly allow industry to harness the potential of ongoing national initiatives thus increasing uptake of AI systems across many industrial sectors and thereby accelerating the green and digital transformation. A good way to ensure that the complex socio-technical systems being created with AI will in practice adhere to ethical standards is to actively involve all people devising and implementing such systems. Option 1 ensures the involvement of those taking responsibility and accountability for the ethical implications. At this stage a soft law approach is preferable to risking a serious disturbance of this transformation. Such disturbance could arise as a result of a lengthy and difficult legislative procedure borne out of the desire to introduce hard law to regulate only a very few contentious applications, already covered by other parts of EU law (e.g. data, privacy, safety and liability). 
Whilst EUnited also believes that there may be some benefit to pursuing regulation for highest risk applications (i.e. Policy Option 3(1)), we think that it is premature given the difficulties we will inevitably face in distinguishing risk levels related to vastly different use-cases of similar or identical applications, all in a rapidly evolving context. To put it another way, an application such a facial recognition could be totally benign or extremely risky depending on the use-case. Sectors such as ours rely heavily on innovation through offering new functionalities to the customer. Indeed, this is the key to remaining competitive. So a one-size-fits-all approach to the regulation of different applications of AI is not in the interest of Europe. EUnited therefore clearly rejects an Option 3(3) approach. It adds no additional benefit while seriously damaging European competitiveness.
The potential for European industry to support the green and digital transformation through uptake of AI shouldn’t be overlooked. The European institutions should keep the competitiveness of Europe at the forefront when considering any legal intervention on AI, particularly given the breadth of coverage of the exiting legal framework. EUnited recommends the approach set out in Policy Option 1 to best strike the balance at this stage."
Fair Trials (United Kingdom),"Fair Trials is aware that the Inception Impact Assessment considers the entire and wide array of economic and societal issues in relation to AI across a spectrum of industries and social activities. However, this response is concerned specifically with AI in the context of criminal justice and will consider the legal and policy measures needed for the regulation of AI in criminal justice. Rapid technological advancements in recent years have...",https://ec.europa.eu/info/law/better-regulation/have-your-say/initiatives/12527-Artificial-intelligence-ethical-and-legal-requirements/F550917_en,6,F550917,10 September 2020,Bruno Min,Non-governmental organisation (NGO),Fair Trials,Small (10 to 49 employees),302540016347-29,United Kingdom,Artificial intelligence – ethical and legal requirements,"Fair Trials is aware that the Inception Impact Assessment considers the entire and wide array of economic and societal issues in relation to AI across a spectrum of industries and social activities. However, this response is concerned specifically with AI in the context of criminal justice and will consider the legal and policy measures needed for the regulation of AI in criminal justice.

Rapid technological advancements in recent years have made machine learning and algorithmic automated decision-making systems, often referred to as artificial intelligence (‘AI’) a prominent aspect of our lives. There is little doubt that these systems have great capacity to increase human potential and improve the lives of many, but their increasing role in assisting important public functions has also highlighted serious risks and challenges, particularly in the context of criminal justice. If not subject to proper regulation and oversight, AI can threaten fundamental human rights and, far from expanding human potential, it can amplify and worsen harmful aspects of our society, including inequality and injustice.

Fair Trials is grateful for the opportunity to submit feedback on the EU Commission’s AI Inception Impact Assessment. We submitted a response to the EU Commission’s consultation on the White Paper, ‘Regulating Artificial Intelligence for Use in Criminal Justice Systems in the EU’, which provided evidence and analysis about the negative impact that ‘AI’ can have on criminal justice.

We are pleased that the EU Commission recognises that AI represents risks for fundamental rights, including the right to a fair trial, as well as the need for improvements to the EU’s legislative framework on AI, particularly the ‘effective application and enforcement of existing EU and national legislation’, as well as the ‘limitations of scope of existing EU legislation’.

We are also pleased to see that the objectives identified in the Roadmap include preventing or minimising significant risks for fundamental rights, as well as ensuring the effective enforcement of rules of existing EU law to protect fundamental rights and avoid illegal discrimination. However, with regards to the policy options stated in the Roadmap, in order to achieve the above stated objectives to protect and minimise risks to fundamental rights and prevent discrimination, we believe that there is a clear need for a legislative solution under Option 3. For the purposes of protecting rights in criminal justice, any legislative proposal would at the very least need to cover ‘high-risk’ applications (Option 3, second sub-option b), but more comprehensive protection may be offered by a legislative act which covered all AI applications (Option 3, third sub-option c)."
José Antonio Parrilla (Spain),"Since February 2020 I am part of PANELFIT, an EU 2020 research project whose objectives and outcomes are: - To facilitate the implementation of European data protection new regulation by producing a set of outcomes that serve as operational standards and practical guidelines able to reduce the ethical and legal issues (ELI henceforth) posed by ICT technologies while promoting innovation and market growth, enabling high-quality job creation...",https://ec.europa.eu/info/law/better-regulation/have-your-say/initiatives/12527-Artificial-intelligence-ethical-and-legal-requirements/F550910_en,6,F550910,10 September 2020,José Antonio Parrilla,EU citizen,,,,Spain,Artificial intelligence – ethical and legal requirements,"Since February 2020 I am part of PANELFIT, an EU 2020 research project whose objectives and outcomes are: 
- To facilitate the implementation of European data protection new regulation by producing a set of outcomes that serve as operational standards and practical guidelines able to reduce the ethical and legal issues (ELI henceforth) posed by ICT technologies while promoting innovation and market growth, enabling high-quality job creation and ensuring a high level of privacy and security/cybersecurity.
- To suggest possible concrete improvements to the current regulatory and governance framework for the same purpose
- To create mutual learning and support tools and to promote networking among stakeholders and policymakers
- To increase the quantity and quality of the information available to policymakers, professionals, journalists and the general public.

As part of these objectives, I submit comments on the EU Proposal for a legal act laying down requirements for Artificial Intelligence. The feedback focuses on the convenience of the different levels of intervention explained in the Proposal and two specific issues: the black box phenomenon as a problem for developing rules on AI-tools liability and the accountability principle (art. 5.2 GDPR) as a current rule to guarantee AI-tools transparency."
European Tech Alliance (Belgium),"In February 2020, members of the European Tech Alliance (EUTA) joined forces to publish the EUTA High Level Principles on AI ahead of the publication of the European Commission’s White Paper on AI. EUTA members strongly believe the EU has the potential to become a world leader in AI. Europe benefits from a vibrant ecosystem of top academic talent, leading AI research labs and an ever growing number of AI-driven start-ups. This fruitful...",https://ec.europa.eu/info/law/better-regulation/have-your-say/initiatives/12527-Artificial-intelligence-ethical-and-legal-requirements/F550909_en,6,F550909,10 September 2020,Jan Rempala,Business association,European Tech Alliance,Micro (1 to 9 employees),189607519323-76,Belgium,Artificial intelligence – ethical and legal requirements,"In February 2020, members of the European Tech Alliance (EUTA) joined forces to publish the EUTA High Level Principles on AI ahead of the publication of the European Commission’s White Paper on AI. EUTA members strongly believe the EU has the potential to become a world leader in AI. Europe benefits from a vibrant ecosystem of top academic talent, leading AI research labs and an ever growing number of AI-driven start-ups. This fruitful ecosystem is supported by industry best practices and the strong fundamentals of the EU's regulatory architecture. 

 Against this backdrop and our contribution to the public consultation on the AI White Paper last Spring, we welcome the opportunity to share the following comments, attached,  on the European Commission’s inception impact assessment “Artificial Intelligence – Ethical and Legal requirements”"
Zsolt BARTFAI (Hungary),"I am in favour of a piece of sectoral legislation that provides a comprehensive legal framework of the privacy related aspects of the AI. This legal act should – while preserving the principles of the privacy (e.g. GDPR) –, surely, deter from the rules of the GDPR to the necessary extent in order to provide AI-tailored privacy provisions. Therefore, Option 3 (as presented in the Inception Impact Assessment) seems to be the best option. The...",https://ec.europa.eu/info/law/better-regulation/have-your-say/initiatives/12527-Artificial-intelligence-ethical-and-legal-requirements/F550908_en,6,F550908,10 September 2020,Zsolt BARTFAI,EU citizen,,,,Hungary,Artificial intelligence – ethical and legal requirements,"I am in favour of a piece of sectoral legislation that provides a comprehensive legal framework of the privacy related aspects of the AI.  This legal act should – while preserving the principles of the privacy (e.g. GDPR) –, surely, deter from the rules of the GDPR to the necessary extent in order to provide AI-tailored privacy provisions. Therefore, Option 3 (as presented in the Inception Impact Assessment) seems to be the best option. 
The followings could be – from privacy perspective – topics of an AI-related sectoral legislative act (taking also into account the principle laid down in recital 4  of the GDPR):
a) Declaration of the possibility of use AI solutions that meet the requirements of the given legislative act – this would create the legal ground (different from the GDPR) for the use of AI;
b) Limitation on the potential use (i.e. the purposes) of AI solutions (either “blacklist” – i.e. forbidden use, or “white list” – i.e. allowed use), including the special conditions to be met. On the other hand, the new legislative act should adapt specific rules “to permit organizations to repurpose data already collected, as long as doing so poses only minimal risk of harm to individuals and does not involve the transfer of data from one controller to another”; 
c) Special rules for some data processing activities, e.g. general permission for use of personal data as training data – with no or limited possibility to opt out. In this way, the future legislation might ease the strict interpretation of “data minimization” principle as well;
d) Specific rules on transparency, inc. the minimum set of information to be shared with data subjects on the “logic” of AI;
e) If necessary, some limitations on the data subject rights (e.g. on erasure or objection to ensure the availability of the data for the purpose of training of AI); 
f) AI-specific data security measures (e.g. compulsory pseudonymization or anonymization, other rules stricter than the general ones);
g) Allocation of obligations on those actors who are “best placed to address any potential risks”. It means that the personal scope of the new legislative act should not be limited to data controller and data processors, but should “include the developer, the deployer (the person who uses an AI-equipped product or service) and potentially others (producer, distributor or importer, service provider, professional or private user)” – with carefully allocated adequate responsibilities."
The Polish Confederation Lewiatan (Poland),"Jasna i szeroko rozumiana definicja sztucznej inteligencji będzie miała kluczowe znaczenie dla skuteczności wszelkich przyszłych ram regulacyjnych. Dlatego przestrzegamy przed zdefiniowaniem Sztucznej Inteligencji, jako tzw. automatycznego system podejmowania decyzji. Tak rozumiana definicja Sztucznej Inteligencji byłaby sprzeczna z kierunkiem regulacji zaproponowanym przez KE w Białej Księdze. Co więcej, mogłaby doprowadzić do powstania...",https://ec.europa.eu/info/law/better-regulation/have-your-say/initiatives/12527-Artificial-intelligence-ethical-and-legal-requirements/F550907_en,6,F550907,10 September 2020,Elżbieta Dziuba,Non-governmental organisation (NGO),The Polish Confederation Lewiatan,Medium (50 to 249 employees),,Poland,Artificial intelligence – ethical and legal requirements,"Jasna i szeroko rozumiana definicja sztucznej inteligencji będzie miała kluczowe znaczenie dla skuteczności wszelkich przyszłych ram regulacyjnych. Dlatego przestrzegamy przed zdefiniowaniem Sztucznej Inteligencji, jako tzw. automatycznego system podejmowania decyzji. Tak rozumiana definicja Sztucznej Inteligencji byłaby sprzeczna z kierunkiem regulacji zaproponowanym przez KE w Białej Księdze. Co więcej, mogłaby doprowadzić do powstania nieuzasadnionych obowiązków regulacyjnych, z których wiele może znacznie utrudnić rozwój i rozpowszechnienie korzystnych zastosowań Sztucznej Inteligencji w Europie. 
Zwracamy uwagę na nieprecyzyjny charakter pojęcia ""szkody niematerialnej"". Niestety, definicja ta może oznaczać wszystko, od strat gospodarczych do bolesnych emocji, i może prowadzić do niepewności prawnej, zniechęcając do inwestycji i innowacji. W zamian proponujemy, aby przyszłe regulacje odnosiły się do pojęcia ""znacznego ograniczenia korzystania z praw podstawowych"". Pojęcie to jest zbliżone do istniejących ram prawnych.
Przede wszystkim, jesteśmy przeciwni jakimkolwiek nowym regulacjom. Stoimy na stanowisku, że już obecnie Sztuczna Inteligencja podlega wielu istniejącym przepisom, takim jak choćby RODO. Dlatego też przed stworzeniem jakichkolwiek nowych regulacji, należy zapewnić prawidłowe wdrożenie obecnych przepisów prawnych UE w tym zakresie. 
Niezależnie od tego jakie podejście regulacyjne jest stosowane, należy zapewnić wsparcie przemysłu we wdrażaniu norm w zakresie odpowiednich praktyk w zastosowaniu Sztucznej Inteligencji. 
Ponadto, jesteśmy przeciwni tzw. systemowi etykietowania. Uważamy, że nie spełni on zakładanej funkcji, a przyczyni się z znacznym stopniu do jeszcze większego obciążenia administracyjnego MŚP, a także nałoży na tych przedsiębiorców nowe obowiązki dotyczące oznakowania. Koszty dostosowania się do tego typu systemu mogłyby znacznie przewyższyć korzyści z niego płynące. 
Ważne jest, aby przy konstruowaniu jakichkolwiek nowych regulacji zachować elastyczność interpretacji prawnej i współpracować z osobami zajmującymi się rozwojem AI w celu opracowania przepisów, które będą wykonalne z technicznego punktu widzenia. AI to zestaw technologii zdolnych do uczenia się, wnioskowania, dostosowywania i wykonywania zadań  w sposób inspirowany przez umysł ludzki. Technologia ta stale się rozwija i ulepsza. Potencjalne korzyści z rozwoju AI są olbrzymie. Przepisy powinny uwzględniać szybkie tempo postępu technologicznego.
Komisja słusznie stwierdziła potrzebę dobrze zdefiniowanego, opartego na ryzyku podejścia do regulacji AI, które nie stosuje logiki „jeden rozmiar dla wszystkich” w niezliczonych aplikacjach AI. Dobrym przykładem rozwiązania, do którego można by zastosować obowiązkowe wymogi w oparciu o analizę ryzyka jest chociażby system zdalnej identyfikacji biometrycznej. Należy pamiętać, że każda ocena ryzyka powinna mieć charakter holistyczny, odzwierciedlający nie tylko potencjalne szkody, ale również możliwości społeczne. Sztuczna inteligencja to zestaw technologii zdolnych do uczenia się, rozumowania, dostosowywania i wykonywania zadań w sposób zainspirowany przez ludzki umysł. Technologia ta stale się rozwija i doskonali. Potencjalne korzyści płynące z jej rozwoju są ogromne. Przepisy powinny uwzględniać szybkie tempo postępu technologicznego. Mając to na uwadze, należy wprowadzić szereg dostosowań, aby zapewnić, że wszelkie potencjalne regulacje będą ukierunkowane na właściwe przypadki użycia, zwiększą pewność prawną i nie zniechęcą do rozwoju i rozpowszechniania AI. 
Uważamy, że najlepsze podejście do aplikacji AI wysokiego ryzyka to ocena rozwiązań ex-post. Rozumiemy oczywiście, że są dziedziny, w których ocena ex-ante stanowi utrwaloną praktykę, np. medycyna, jednakże w tych dziedzinach postulujemy, aby ocenę ex-ante połączyć z oceną stosowanych praktyk sektorowych."
Japan Business Council in Europe (Belgium),"JBCE welcomes the European Commission’s efforts to establish a common European approach to AI. This will help the EU’s AI market reach scale and avoid legal uncertainty or fragmentation of multiple policies among EU Member States, through protecting our safety, consumer rights and fundamental rights when we use AI applications. 1.Our recommendation Considering the different levels of risk that could be generated by AI applications, we...",https://ec.europa.eu/info/law/better-regulation/have-your-say/initiatives/12527-Artificial-intelligence-ethical-and-legal-requirements/F550904_en,7,F550904,10 September 2020,Takenobu Kurihara,Business association,Japan Business Council in Europe,Micro (1 to 9 employees),68368571120-55,Belgium,Artificial intelligence – ethical and legal requirements,"JBCE welcomes the European Commission’s efforts to establish a common European approach to AI. This will help the EU’s AI market reach scale and avoid legal uncertainty or fragmentation of multiple policies among EU Member States, through protecting our safety, consumer rights and fundamental rights when we use AI applications.

1.Our recommendation

Considering the different levels of risk that could be generated by AI applications, we support the Commission’s proposal of a risk-based approach and would recommend Option 4. This means that the EU’s consideration on regulation should be limited to high-risk AI only, with detailed requirements being determined by industry via a soft law approach. The EU must also help avoid duplications between future regulations and current laws and ensure harmonization with international rules and existing regulatory schemes, minimizing the burden on businesses.

2.Scope of high-risk AI

2.1.We welcome the preliminary ideas proposed by the Commission in the White Paper (p. 17 – sector and specific use), but it is essential to develop clear criteria and definitions through dialogues with industry to ensure legal certainty and to distinguish between high-risk and low-risk AI. In our view, some examples of non-high-risk AI include, but are not limited to, the following types of applications:

Mobility
Driver assistant safety and monitoring systems, biometric ID to unlock and start automobiles, vehicles navigation systems with voice recognition and telematic services.

Manufacturing
Fiber laser processing machines, intellectualization of industrial robots, real-time data analyzers.

Home, offices & shops
Air conditioning systems, digital still cameras/camcorders (automatic focus, smile detection), emotion visualization, ID card.

3.Requirements on high-risk AI

3.1.We welcome the scenario outlined in the IIA p.5 in which the principles and basic regulatory framework are legislated by the EU institutions, but the details of each requirement should be determined by industry (soft law approach). AI is constantly evolving, and it is difficult to pre-determine detailed regulations or to amend them in a timely manner. Therefore a future-proof regulatory framework, rather than specific and sectorial regulations that could stifle the EU’s competitiveness in this field, has to be preferred.

3.2.New ex-ante conformity assessments such as testing and algorithms verifications or data sets, inspections and certifications could be disproportionate for certain applications, but we would support further discussion on how to build a credible assessment mechanism that is capable of checking the trustworthiness of AI applications throughout their life time.

3.3.It is important to ensure that there is no duplication between the future regulatory framework for high-risk AI and existing EU legislation. We also believe that the establishment of a new independent AI authority could bring low added value: some of the potentially high-risk sectors or AI applications are already subject to strict ex-ante rules, which should continue to be covered under existing law and amended if necessary.

4.Facial recognition and biometric data

4.1.There is a broad range of facial recognition technologies and applications that process biometric data. As such, we would warn against adopting a one-size-fits-all approach when considering regulation for these applications. A general ban would compromise innovation and competitiveness for the development of new technologies, products and services.

4.2.For AI solutions based on biometric parameters, we encourage the development of a framework that excludes non high-risk applications.

4.3.Some remote biometric identification solutions used in public spaces could be identified as high-risk applications. They should be regulated under the EU’s future framework on AI, but as long as such solutions are complying with future requirements, they should be allowed in publicly accessible spaces."
